ID,name_product,price_product,number_purchaser,name_store,address
180,毛绒帽子围巾手套一体女秋冬季骑车防寒护耳百搭加厚保暖连帽纯色,32.00元,8000+人收货,卡兰薇旗舰店,浙江
181,儿童帽子围巾一体冬季兔耳朵会动女童围脖毛绒可爱男童宝宝秋冬款,27.90元,8000+人收货,good88旗舰店,浙江
182,2023新款秋冬季帽子男士抓绒帽双面保暖针织帽毛线帽护耳防寒冷帽,32.00元,8000+人收货,浊酒余生旗舰店,广东
183,毛线帽子男士冬天户外套头保暖秋冬针织帽加绒加厚围脖防风两件套,5.22元,8000+人收货,天天特卖工厂店,浙江
184,骆驼冬季新款羊毛纱针织帽女护耳保暖毛线冷帽显脸小情侣针织帽男,49.00元,8000+人收货,骆驼官方旗舰店,广东
185,胡茬叔叔原创针织帽毛线帽男女同款冬季加厚防寒保暖护耳套头帽子,32.00元,8000+人收货,胡茬叔叔FOURTHSTUDIO,广东
186,小熊毛绒帽子围巾一体女秋冬季韩版显脸小百搭加厚保暖护耳雷锋帽,35.80元,8000+人收货,问香坊,浙江
187,中老年人帽子男士冬天爸爸鸭舌帽爷爷加绒护耳保暖帽老人冬季棉帽,36.00元,8000+人收货,麻设旗舰店,江苏
188,海澜之家针织帽毛线帽男士含羊毛冬季保暖加绒大头围2023新款帽子,59.00元,8000+人收货,海澜之家服饰配件旗舰店,山东
189,FINE STATE帽子男冬季2023新款大头围堆堆帽包头帽保暖冷帽男款,29.90元,8000+人收货,FINESTATE旗舰店,浙江
190,稻草人帽子女秋冬季加绒加厚保暖毛绒渔夫帽时尚护耳包头盆帽新款,29.00元,8000+人收货,稻草人服饰配件旗舰店,浙江
191,帽子女2023新款秋冬可爱毛绒绒小熊耳朵帽子保暖护耳大头围雷锋帽,29.99元,8000+人收货,karaya旗舰店,浙江
192,啄木鸟中老年人老人帽子女士妈妈秋冬季加厚老太太奶奶针织毛线帽,39.00元,8000+人收货,啄木鸟禄阔专卖店,浙江
193,卡通儿童帽子围巾手套一体三件套冬季保暖男女宝宝加绒加厚防风,31.80元,8000+人收货,月色真美Moonlight,浙江
194,冬天帽子女秋冬季毛线帽大头围黑色冷帽保暖护耳月子粗针织堆堆帽,27.90元,8000+人收货,暖故事旗舰店,浙江
195,兔毛堆堆帽子女新款秋冬韩版保暖渔夫帽适合大脸冷帽显脸小水桶帽,29.80元,8000+人收货,billizilly旗舰店,广东
196,百搭小熊帽子围巾一体女2023冬季新款冬天手套围脖女生头套三件套,39.90元,8000+人收货,琳澈旗舰店,江苏
197,冬帽男保暖针织帽子男士加绒加厚骑车防风防寒滑雪护耳毛线包头帽,8.90元,8000+人收货,天天特卖工厂店,浙江
198,大头围毛线帽女秋冬季保暖显脸小帽子冷帽2023新款防寒护耳针织帽,31.50元,7000+人收货,木村耀司旗舰店,浙江
199,圣诞节装饰用品圣诞帽大红无纺布圣诞老人帽子成人儿童头饰发光帽,0.73元,7000+人收货,知方阁官方店,广东
200,黑色帽子男士冬季保暖毛线帽针织帽大头围冷帽男潮新款加厚瓜皮帽,24.00元,7000+人收货,春虫虫旗舰店,浙江
201,毛线帽秋冬季男女时尚套头帽韩版潮加绒加厚针织帽保暖帽包头帽子,19.80元,7000+人收货,dreamsinavila旗舰店,浙江
202,芝士商店~黑色报童帽女显脸小帽子秋冬复古八角帽画家帽贝雷帽ins,35.00元,7000+人收货,芝士商店cheese,浙江
203,帽子冬季男雷锋帽男士冬天防寒面罩骑车保暖神器棉帽男款防寒耳罩,35.00元,7000+人收货,柔立旗舰店,浙江
204,加绒毛线帽冬季加厚保暖东北针织帽女大头围护耳毛球帽子白色球帽,8.60元,7000+人收货,微利帽业精品店,浙江
205,男士帽子冬季青年保暖加厚针织毛线帽韩版潮加绒秋冬棉帽防寒套头,9.90元,7000+人收货,姗禹旗舰店,浙江
206,帽子女冬款保暖电动车户外骑车护耳东北防寒雷锋帽男冬季加绒加厚,32.00元,7000+人收货,慕艳雪旗舰店,浙江
207,帽子男冬季中老年老人保暖爸爸爷爷加绒加厚护耳防寒针织毛线帽,35.00元,7000+人收货,思哲服饰专营店,浙江
208,粥可可手工针织帽子女2023新款冬拼接保暖渔夫帽毛线帽护耳毛绒帽,37.90元,7000+人收货,粥可可,浙江
209,帽子围巾一体男防风圣诞男士冬季保暖毛绒男生围脖耳罩男生三件套,33.55元,7000+人收货,柔立旗舰店,浙江
210,毛线帽子女秋冬季保暖显脸小兔毛绒大头围水桶渔夫护耳针织醒狮帽,29.80元,7000+人收货,元菲璐旗舰店,浙江
211,2022年帽子女粗针织毛线帽秋冬季百搭大头围绿色宽松ins潮显脸小,11.52元,7000+人收货,问香坊,浙江
212,深顶大头围棒球帽女2023新款显脸小加大宽帽檐鸭舌帽子夏季防晒帽,9.80元,7000+人收货,黑眼豆豆zhou,浙江
213,狐狸耳朵帽子女款2023新款可爱毛绒秋冬季百搭时尚围脖围巾一体帽,24.99元,7000+人收货,欧蝶莎旗舰店,浙江
214,高品质/澳洲羊毛贝雷帽不易起球韩版纯色复古画家帽子女生/版型好,48.00元,7000+人收货,胡茬叔叔FOURTHSTUDIO,广东
215,可爱小熊耳朵毛绒帽子2023年爆款女秋冬加厚保暖毛茸茸针织毛线帽,22.80元,7000+人收货,鹿一工作室,浙江
216,婴儿帽子秋冬季婴幼儿宝宝护耳毛线帽冬款一岁女儿童针织帽0一6月,33.00元,7000+人收货,minitutuya旗舰店,浙江
217,可爱小熊耳朵帽子女冬季保暖骑车护耳滑雪帽棉帽东北防寒雷锋帽男,32.00元,7000+人收货,慕艳雪旗舰店,浙江
218,黑色帽子男士冬季潮堆堆帽男士大头围冷帽包头帽针织帽保暖毛线帽,5.62元,7000+人收货,天天特卖工厂店,浙江
219,定制款~红色巴拉克拉法帽女2023冬季新款保暖脖套帽子围巾一体ins,39.00元,7000+人收货,芝士商店cheese,浙江
220,雷锋帽男女东北棉帽子冬季护耳防寒防风帽冻户外骑车加厚保暖神器,17.80元,7000+人收货,玖霖旗舰店,浙江
221,骑车面罩防风防寒神器秋冬季保暖全脸女帽子男口罩护耳冬天电动车,4.80元,7000+人收货,hcop旗舰店,浙江
222,稻草人男士帽子雷锋帽冬季加绒保暖爸爸爷爷老年人防寒护耳老人帽,29.90元,7000+人收货,稻草人服饰配件旗舰店,浙江
223,婴儿帽子秋冬季可爱超萌新生婴幼儿胎帽男女宝宝毛线帽初生针织帽,19.80元,7000+人收货,依依宝贝studio,浙江
224,啄木鸟中老年人帽子男士冬季棒球男老年冬天男爸爸爷爷保暖鸭舌帽,36.90元,7000+人收货,啄木鸟纳众专卖店,浙江
225,帽子女冬天防寒护耳防风头套连帽围脖一体电动车骑行保暖头盔内胆,28.00元,7000+人收货,宝姬兰旗舰店,浙江
226,2023新款帽子男女秋冬季保暖护耳针织帽毛线帽黑色灰色加绒户外,12.90元,7000+人收货,欢琳旗舰店,浙江
227,儿童帽子冬季女童加绒秋冬款女孩2023新款毛线帽宝宝针织帽女宝,28.00元,7000+人收货,萌柚兔旗舰店,浙江
228,可爱小熊帽子保暖围脖围巾一体连帽女秋冬季保暖手套加厚绒三件套,42.00元,7000+人收货,型公馆服饰旗舰店,江苏
229,李宁毛线帽男士冬季帽子户外保暖加绒针织帽男运动大头帽冷帽男款,39.00元,7000+人收货,李宁利都全时专卖店,浙江
230,宝宝帽子秋冬季2023新款女童儿童帽子围巾一体男孩婴幼儿围脖加绒,36.00元,7000+人收货,minitutuya旗舰店,浙江
231,100%纯羊毛针织帽子女士秋冬款百搭大帽围防寒遮耳保暖毛线包头帽,129.00元,7000+人收货,绘典旗舰店,浙江
232,KK树儿童帽子秋冬宝宝雷锋帽冬季男童女童小孩加绒保暖护耳帽2023,36.72元,7000+人收货,kocotree旗舰店,浙江
233,正品JEEP吉普帽子男女运动棒球帽防晒纯棉帽子太阳平顶鸭舌帽秋冬,41.08元,7000+人收货,吉普州德专卖店,上海
234,大头围显脸小秋冬宽松毛线帽冷帽潮ins月子保暖护耳灰色针织帽女,6.72元,7000+人收货,天天特卖工厂店,浙江
235,羊毛帽子女秋冬季加厚保暖毛线帽骑行电动车防风防寒护脖套头一体,25.00元,7000+人收货,翡希莉旗舰店,浙江
236,跑量款/纯色羊毛贝雷帽女生冬季百搭蓓蕾帽日系文艺复古画家帽子,29.80元,7000+人收货,胡茬叔叔FOURTHSTUDIO,广东
237,帽子男冬季保暖加绒针织毛线帽冬天男士棉帽防寒围脖骑车男款冬帽,18.80元,7000+人收货,巧米莎旗舰店,浙江
238,新款可爱企鹅保暖毛绒帽子女冬季加厚防寒护耳雷锋帽骑车滑雪帽男,39.00元,7000+人收货,CAPROOM,浙江
239,冬季保暖百搭双面针织毛线帽女潮流字母加厚韩版堆堆帽休闲冷帽男,22.80元,7000+人收货,章小鱼的帽子屋,浙江
240,帽子冬季男士款巴拉克拉法帽针织毛线帽防风防寒头套面罩保暖冷帽,11.88元,7000+人收货,天天特卖工厂店,浙江
241,宝宝儿童帽子可爱护耳加绒加厚帽子围巾一体婴儿帽子秋冬婴幼儿,62.00元,7000+人收货,尼多熊旗舰店,浙江
242,cacuss羊毛毛线帽子男围巾针织帽大头围新款冬季时尚保暖包头冷帽,68.00元,7000+人收货,cacuss旗舰店,江苏
243,蜗牛爬爬家 可爱小熊帽耳朵毛绒帽子女秋冬保暖护耳帽针织毛线帽,32.00元,7000+人收货,蜗牛爬爬家,浙江
244,儿童帽子秋冬季男女童户外骑行防风面罩护耳套头帽宝宝围巾一体帽,29.00元,7000+人收货,首约旗舰店,浙江
245,小熊毛线帽子女2023年新款可爱毛绒保暖毛毛大头围针织头套秋冬季,30.80元,7000+人收货,木村耀司旗舰店,浙江
246,帽子男士秋冬季保暖毛线帽大头围针织帽潮牌棉帽加绒男款冬天冷帽,22.90元,7000+人收货,罕奇旗舰店,浙江
247,帽子男冬季保暖毛线帽针织套头帽冬天男士围脖套帽加厚包头帽骑车,19.80元,7000+人收货,台柔旗舰店,浙江
248,毛线帽男士秋冬帽子潮男款保暖百搭冷帽宽松大头围显脸小针织帽男,5.80元,7000+人收货,淘工厂10元店,浙江
249,小熊耳朵毛绒帽女秋冬季护耳保暖可爱堆堆帽显脸小大头围毛线帽子,20.52元,7000+人收货,问香坊,浙江
250,秋冬季加绒男士帽子韩版时尚毛线帽钓鱼旅游骑车户外防寒保暖棉帽,3.50元,7000+人收货,俏俏家居精品日用百货小商品,浙江
251,宝宝帽子秋冬款儿童围巾一体帽女孩可爱婴儿毛绒帽冬季男孩护耳帽,26.80元,7000+人收货,织婴鸟旗舰店,浙江
252,狐狸耳朵帽子围巾一体女秋冬季2023新款保暖骑行防寒护耳可爱围脖,24.90元,7000+人收货,博昂电子商贸有限公司,浙江
253,代购无印毛线帽子女秋冬百搭羊毛混纺针织帽日系大头围保暖护耳帽,26.80元,7000+人收货,无印专购特卖店,浙江
254,防寒帽男冬天老年人帽子男雷锋帽加绒保暖爸爸爷爷骑车棉帽防风帽,29.00元,7000+人收货,貌之恋旗舰店,江苏
255,日系针织帽笑脸标毛线帽子女秋冬季可爱潮流百搭护耳黑色保暖男,8.90元,7000+人收货,简牛旗舰店,浙江
256,HUGZ儿童帽子秋冬针织毛线帽围巾一体男女孩宝宝护耳防风2023新款,89.00元,6000+人收货,HUGZ旗舰店,浙江
257,中老年人东北雷锋帽男护耳冬季爷爷加厚保暖老人火车头爸爸棉帽子,26.00元,6000+人收货,拼棉旗舰店,浙江
258,骑行面罩围脖一体帽子男冬季骑车保暖防风防寒滑雪脖套头套女秋冬,37.80元,6000+人收货,无橘旗舰店,浙江
259,初生婴儿隔离防护面罩宝宝防飞沫帽儿童遮脸防疫帽可调节防护帽子,8.96元,6000+人收货,天天特卖工厂店,浙江
260,电动车保暖帽子围脖一体帽女冬天骑车加绒加厚新款防风套头帽保暖,11.68元,6000+人收货,百兰诗旗舰店,浙江
261,儿童帽子冬季男孩针织毛线护耳帽中大童保暖加厚围脖亲子套头棉帽,29.00元,6000+人收货,待续春风旗舰店,浙江
262,帽子女秋冬2023新款百搭显脸小加厚保暖毛线帽护耳包头冷帽针织帽,21.90元,6000+人收货,天天特卖工厂店,浙江
263,秋冬贝雷帽女生韩版百搭显脸小八角帽文艺复古报童帽日系画家帽子,32.00元,6000+人收货,胡茬叔叔FOURTHSTUDIO,广东
264,狐狸毛毛绒帽子围巾一体女款秋冬季时尚可爱骑车围脖保暖2023新款,29.00元,6000+人收货,怡情花旗舰店,浙江
265,帽子冬季女加绒加厚防风面罩电动车骑行保暖神器男头套棉帽雷锋帽,16.31元,6000+人收货,天天特卖工厂店,浙江
266,杨幂同款小熊帽子女毛绒保暖2023新款冬季韩版可爱防寒护耳针织帽,29.80元,6000+人收货,billizilly旗舰店,广东
267,帽子冬季男女通用韩版加绒加厚针织帽保暖毛线帽帽子围脖两件套,5.98元,6000+人收货,精选高端皮具特卖,浙江
268,宝宝帽子围脖一体口罩秋冬季儿童毛绒护耳套头帽男童女童可爱超萌,19.90元,6000+人收货,依依宝贝studio,浙江
269,冬天保暖男女户外骑行电动车挡风御寒防冻头盔内衬加绒加厚套头帽,10.90元,6000+人收货,美帽搭档,浙江
270,帽子女士冬季2023新款保暖骑车防风面罩防寒加厚护颈脖套围脖一体,8.62元,6000+人收货,天天特卖工厂店,浙江
271,婴儿帽子秋冬款纯棉新生婴幼儿春秋护卤门帽初生宝宝可爱冬季胎帽,14.80元,6000+人收货,金顶冠旗舰店,浙江
272,帽子男士冬季鸭舌帽遮阳太阳帽春秋款钓鱼帽骑车防晒女棒球帽夏天,9.90元,6000+人收货,纪梵保罗旗舰店,浙江
273,中老年人帽子男冬季保暖爸爸老人皮帽加绒加厚防风老头护耳鸭舌帽,39.90元,6000+人收货,啄木鸟纳众专卖店,浙江
274,帽子男士秋冬保暖毛线帽男款百搭冷帽潮宽松大头围显脸小针织帽男,7.57元,6000+人收货,天天特卖工厂店,浙江
275,鹿角帽子女冬季毛绒加厚保暖东北棉帽户外骑车防风寒护耳雷锋帽男,29.80元,6000+人收货,羡项旗舰店,浙江
276,洋气好看的大头围针织毛线堆堆帽子女士秋冬季款2023新款冬天百搭,9.61元,6000+人收货,天天特卖工厂店,浙江
277,针织帽男帽子女秋冬季毛线帽黑色2023新款冷帽美式大头围保暖1277,19.80元,6000+人收货,苏宁易购官方旗舰店,江苏
278,毛线帽男士冬季冷帽潮牌日系冬天保暖棉帽男生秋冬帽子男款针织帽,24.00元,6000+人收货,贝纳登旗舰店,浙江
279,【88VIP】小熊帽子围巾一体女秋冬季骑行防寒保暖护耳可爱毛绒手套口罩百搭,99.00元,6000+人收货,银泰百货旗舰店,浙江
280,外贸帽子秋冬针织毛线帽男士运动抓绒帽双面可戴护耳冷帽防寒保暖,32.80元,6000+人收货,莱艳宛旗舰店,广东
281,可爱小熊毛绒针织毛线帽子女2023新款秋冬季保暖毛茸茸套头护耳帽,18.80元,6000+人收货,恋图秀旗舰店,浙江
282,李宁帽子男士冬季保暖防寒毛线帽男冬天防静电大头围针织帽冷帽女,39.00元,6000+人收货,李宁利都全时专卖店,浙江
283,帽子男士冬季鸭舌帽骑车钓鱼帽防晒遮阳太阳帽女春秋款黑色棒球帽,7.49元,6000+人收货,纪梵保罗旗舰店,浙江
284,毛线帽子女秋冬季大头围羊毛加厚保暖护耳针织堆堆冷帽男2023新款,38.00元,6000+人收货,木村耀司旗舰店,浙江
285,帽子男士冬季中老年人保暖护耳老人爸爸爷爷加厚针织毛线帽男冬天,19.90元,6000+人收货,婕客旗舰店,浙江
286,跑步帽子户外登山保暖速干运动帽防风护耳透气护额头男女秋冬冷帽,17.90元,6000+人收货,行走派正品商城,浙江
287,毛线帽子秋冬保暖针织帽护耳帽女户外骑车防风弹力包头帽男士冷帽,9.80元,6000+人收货,雯茹蒽旗舰店,浙江
288,儿童帽子男童冬季护耳毛绒宝宝可爱恐龙男孩秋冬款手套围巾一体帽,27.90元,6000+人收货,卓花姿旗舰店,浙江
289,冬季骑行帽子女保暖防寒风神器套头电动车风雪遮脸男面罩棉雷锋帽,58.00元,6000+人收货,六彩凤旗舰店,江苏
290,针织毛绒耳朵棉帽2023新款秋冬保暖毛线小熊帽子女冬季可爱白色茸,28.80元,6000+人收货,依衫舞芭旗舰店,浙江
291,小熊帽子围巾一体女秋冬季骑车防寒围脖保暖护耳可爱毛绒手套口罩,35.00元,6000+人收货,惟嫒旗舰店,浙江
292,帽子男冬天羊毛针织帽冷帽防寒羊绒毛线帽加厚保暖秋冬季男士,35.80元,6000+人收货,雾敦堡旗舰店,浙江
293,儿童小熊帽子秋冬季男女童口罩围脖一体可爱加厚保暖宝宝护耳棉帽,13.80元,6000+人收货,天天特卖工厂店,浙江
294,男士帽子2023新款秋冬季男款保暖防风护耳毛线针织帽加厚女款冷帽,8.42元,6000+人收货,天天特卖工厂店,浙江
295,啄木鸟中老年帽子男士冬季爷爷爸爸鸭舌帽冬天老年保暖加厚棒球帽,38.00元,6000+人收货,啄木鸟纳众专卖店,浙江
296,帽子女2023新款冬季加厚毛绒保暖小熊防风骑车围巾一体口罩三件套,16.80元,6000+人收货,公子慢走旗舰店,江苏
297,帽子男士冬季加绒保暖毛线帽冷帽包头春秋针织帽薄款堆堆帽女潮款,18.90元,6000+人收货,纪梵保罗旗舰店,浙江
298,日系宽松大头围加厚毛线针织帽子女冬季显脸小保暖护耳堆堆帽男潮,10.24元,6000+人收货,淘工厂特卖店,北京
299,显脸小兔毛渔夫帽女秋冬百搭保暖大头围盆帽白色素颜毛绒水桶帽子,35.80元,6000+人收货,卡菲翔旗舰店,浙江
300,新款2023秋冬季毛呢八角帽子女网红画家贝雷帽鸭舌ins百搭显脸小,29.80元,6000+人收货,INTHEDREAM旗舰店,浙江
301,FINE STATE黑色帽子新款2023爆款针织帽毛线帽男士冬季大头围冷帽,32.00元,6000+人收货,FINESTATE旗舰店,浙江
302,可爱小熊卡通毛绒连帽围脖女冬季冬天保暖手套帽子围巾一体三件套,25.00元,6000+人收货,黑眼豆豆zhou,浙江
303,中老年人帽子男士2023新款秋冬保暖棒球帽加厚户外百搭爸爸鸭舌帽,13.90元,6000+人收货,博昂电子商贸有限公司,浙江
304,GULESWYCAP毛绒复古针织堆堆帽子女显脸小秋冬防寒保暖毛线冷帽男,38.00元,6000+人收货,GULES WY,广东
305,头套男女摩托车头盔内衬冬季防风寒面罩冬天骑车保暖神器加绒帽子,8.90元,6000+人收货,纪梵保罗旗舰店,浙江
306,中老年人妈妈毛线帽女士冬季加绒加厚兔毛保暖老太太奶奶帽子洋气,28.00元,6000+人收货,婕客旗舰店,浙江
307,高级感台灯帽女生气质素雅纯色盆帽冬季保暖素颜遮脸水桶帽渔夫帽,38.00元,6000+人收货,胡茬叔叔FOURTHSTUDIO,广东
308,2023新款帽子女秋冬季毛绒围脖一体卡通小熊保暖防寒连帽围巾骑行,25.00元,6000+人收货,宝姬兰旗舰店,浙江
309,真兔毛白色毛绒帽子女秋冬季保暖显脸小护耳毛线帽皮草针织渔夫帽,53.00元,6000+人收货,卡菲翔旗舰店,浙江
310,帽子冬季男女通用韩版加绒加厚针织帽保暖毛线帽帽子围脖两件套,6.90元,6000+人收货,精选高端皮具特卖,浙江
311,馨帮帮秋冬搞怪卡通小狗套头帽子女眼睛长耳朵加厚保暖可爱毛绒帽,36.90元,6000+人收货,馨帮帮sinbounboun Acc配饰店,广东
312,中年妈妈帽子女冬季加绒保暖毛线帽中老年人奶奶姥姥老人棉帽围巾,59.00元,6000+人收货,somubay旗舰店,广东
313,伯希和户外抓绒帽男女冬摇粒绒围巾保暖滑雪骑行帽子运动防风围脖,39.00元,6000+人收货,伯希和官方旗舰店,山东
314,可爱小熊耳朵毛毛帽子女款冬显脸小大头围保暖毛线帽毛绒帽雷锋帽,29.90元,6000+人收货,OM原创潮品,浙江
315,回力男士帽子冬季新款防风防寒保暖棉护耳加绒包头帽骑行毛线帽男,25.10元,6000+人收货,金格尔运动专营店,上海
316,毛绒绒针织帽子女秋冬季新款显脸小大头围护耳保暖堆堆冷帽毛线帽,19.80元,6000+人收货,元菲璐旗舰店,浙江
317,冬季妈妈帽子女老人奶奶加绒兔毛线帽中老年人保暖帽加厚针织棉帽,32.90元,6000+人收货,卡帝乐鳄鱼宏丰专卖店,浙江
318,鞠婧t同款帽子女款2023新款大头围卷边堆堆帽高级感秋冬针织冷帽,29.00元,6000+人收货,卡菲翔旗舰店,浙江
319,防风帽子男士冬季骑行加厚保暖面罩护耳围脖头套骑车防寒雷锋棉帽,19.90元,6000+人收货,威伯丹旗舰店,浙江
320,婴儿帽子秋冬季男宝可爱护耳冬帽女童儿童秋冬款幼儿女宝宝毛线帽,25.80元,6000+人收货,布丁新语旗舰店,浙江
321,儿童帽子冬季男孩围脖围巾一体手套恐龙三件套秋冬男女童宝宝帽子,27.90元,6000+人收货,熊朵旗舰店,浙江
322,加厚针织毛线帽女冬季保暖加绒套头帽防寒防风月子包头帽冷帽帽子,26.00元,6000+人收货,首约旗舰店,浙江
323,李宁官方毛线帽子男款冬季大头围防风护耳冷帽加厚保暖防寒针织帽,38.99元,6000+人收货,李宁利都全时专卖店,浙江
324,系带可爱卡通小熊针织毛线帽子女秋冬保暖咖色毛绒绒大头围套头帽,25.90元,6000+人收货,疯帽子在等待爱丽丝,浙江
325,鳄鱼2024年新款帽子男士秋冬保暖鸭舌帽中老年冬季棒球帽加绒加厚,31.28元,6000+人收货,cartelo途乐专卖店,上海
326,新款灵动狐狸耳帽子女秋冬季骑车保暖防寒毛绒帽子围巾一体三件套,36.90元,6000+人收货,芋水萌旗舰店,江苏
327,大头可戴厚款针织帽女加厚护耳保暖套头帽子冬高品质显脸小毛线帽,12.80元,6000+人收货,蒂芙旗舰店,广东
328,慵懒风大头围堆堆帽女秋冬季时尚套头月子帽冷帽显脸小包头帽子女,26.90元,5000+人收货,蜗牛爬爬家,浙江
329,R标咖啡色棒球帽女大头围显瘦显脸小百搭运动帽子男韩版鸭舌帽潮,35.00元,5000+人收货,胡茬叔叔FOURTHSTUDIO,广东
330,Jeep吉普棒球帽男款帽子加绒保暖帽春秋冬季男士品牌鸭舌帽太阳帽,53.00元,5000+人收货,JEEP吉普正品特卖店,河北
331,白色毛绒帽子女冬季可爱网红保暖加绒显脸小兔毛水桶渔夫帽大头围,36.80元,5000+人收货,渐渐青旗舰店,广东
332,毛绒地主帽女秋冬新款防寒保暖帽子东北盆帽护耳帽显脸小渔夫帽潮,39.00元,5000+人收货,雪林鹿旗舰店,浙江
333,冬天儿童可爱小熊帽子围巾一体冬季新款男童女童宝宝加厚毛绒围脖,11.61元,5000+人收货,天天特卖工厂店,浙江
334,秋冬季小熊熊帽子围巾一体女冬天保暖毛绒手套三件套可爱连帽护耳,42.00元,5000+人收货,型公馆服饰旗舰店,江苏
335,冬季保暖头套男女防寒风面罩帽子冬天骑行电动车加绒加厚围脖护脸,39.90元,5000+人收货,辉煌旗觎店,浙江
336,芝士商店~羊毛巴拉克拉法帽女防风保暖骑行脖套护耳帽子围巾一体,34.00元,5000+人收货,芝士商店cheese,浙江
337,ins针织帽子女冬天新款保暖护耳毛线帽韩版宽松大头围网红堆堆帽,28.80元,5000+人收货,mmaocoe旗舰店,浙江
338,稻草人渔夫帽子女秋冬2023新款百搭时尚显脸小保暖加厚毛绒盆帽潮,32.00元,5000+人收货,稻草人晓桦专卖店,浙江
339,秋冬帽子男士中老年人毛呢帽冬季户外护耳棒球帽鸭舌帽保暖爸爸帽,9.90元,5000+人收货,陈喵喵小帽铺,浙江
340,日本帽子女新款银标毛绒渔夫帽大檐秋冬加厚保暖水桶帽百搭盆帽,38.00元,5000+人收货,茉娇婷旗舰店,浙江
341,秋冬毛线帽子女保暖头巾包头帽头套女针织帽宽边护额遮白发发带帽,12.80元,5000+人收货,壹加壹四季帽饰,浙江
342,韩系出片~显脸小纯色系带针织毛线飞行帽女冬百搭护耳学生雷锋帽,29.76元,5000+人收货,奶油小鹿,浙江
343,儿童成人圣诞老人帽子装扮头饰小礼品圣诞节装饰品创意礼物圣诞帽,9.90元,5000+人收货,青陌旗舰店,浙江
344,可爱小熊帽子秋冬季女加厚保暖围巾一体连帽围脖手套三件套针织帽,45.00元,5000+人收货,型公馆服饰旗舰店,江苏
345,黑色贝雷帽女春秋款2023新款ins画家帽显脸小八角帽子大头围秋冬,14.50元,5000+人收货,黑眼豆豆zhou,浙江
346,毛绒帽女兔毛渔夫帽2023冬季新款毛毛帽子保暖大头围显脸小毛茸茸,34.90元,5000+人收货,问香坊,浙江
347,大头围黑色贝雷帽女春秋新款显脸小反戴前进帽秋冬羊毛呢画家帽子,33.00元,5000+人收货,卡菲翔旗舰店,浙江
348,黑色贝雷帽女夏季春秋款韩系大头围蓓蕾帽显脸小网红八角画家帽子,16.80元,5000+人收货,ECNC旗舰店,浙江
349,婴儿帽子秋冬季保暖围巾两件套宝宝可爱防风加厚毛绒套头帽男女童,23.80元,5000+人收货,圣冰猴旗舰店,浙江
350,毛线帽子女款2023新款秋冬季大头围宽松针织堆堆帽百搭显脸小冷帽,35.00元,5000+人收货,卡菲翔旗舰店,浙江
351,帽子男冬季保暖加厚针织毛线帽户外骑车护耳套头帽不加绒包头帽子,12.90元,5000+人收货,天天特卖工厂店,浙江
352,兔毛渔夫帽女2023秋冬季毛绒帽大头围显脸小保暖毛茸茸帽子水桶帽,19.90元,5000+人收货,问香坊,浙江
353,帽子围巾一体男防寒男士冬季保暖毛绒男生围脖耳罩男生三件套圣诞,36.00元,5000+人收货,柔立旗舰店,浙江
354,茉娇婷兔毛帽子女秋冬款加厚保暖防寒毛线帽显脸小皮草毛绒渔夫帽,55.00元,5000+人收货,茉娇婷旗舰店,浙江
355,儿童帽子冬季保暖女童毛绒帽围巾一体帽新款挡风口罩手套男宝宝帽,32.80元,5000+人收货,邦爵鸟旗舰店,浙江
356,卡帝乐鳄鱼帽子男士2023新款秋冬季棒球帽潮鸭舌帽防晒太阳帽男款,28.00元,5000+人收货,卡帝乐柔尚专卖店,浙江
